{
  "bundleVersion": "goffy.pairing.bundle.v1",
  "hubEndpoint": "ws://127.0.0.1:8787/ws/v1",
  "hubIdentity": {
    "mode": "usb_loopback",
    "verifiedBy": "loopback_admin_session",
    "trustedLanSupported": false
  },
  "challenge": {
    "challengeId": "11111111-1111-4111-8111-111111111111",
    "pairingToken": "pairing-token-abcdefghijklmnopqrstuvwxyz0123456789",
    "expiresAt": "2026-07-13T16:02:00Z"
  }
}
